{
  "$schema": "https://json-schema.org/draft/2020-12/schema",
  "$id": "urn:aisidecar:response:subject-isolated:1.6.0",
  "title": "AISidecar Subject Isolated Model Response 1.6.0",
  "type": "object",
  "additionalProperties": false,
  "required": [
    "summary",
    "genre_or_photography_type",
    "species",
    "main_subjects",
    "secondary_subjects",
    "behavior_or_action",
    "proposed_keywords",
    "uncertainty_notes",
    "quality_assessment"
  ],
  "properties": {
    "summary": {
      "type": "string",
      "minLength": 0,
      "maxLength": 280,
      "description": "One concise sentence describing the isolated subject crop."
    },
    "genre_or_photography_type": {
      "type": "array",
      "minItems": 1,
      "maxItems": 4,
      "description": "Ordered from primary to secondary photographic genre/type, using only visible subject evidence.",
      "items": {
        "$ref": "#/$defs/genre_candidate"
      }
    },
    "species": {
      "type": "array",
      "maxItems": 6,
      "description": "Always present. Biological/taxonomy candidates when a genre entry is wildlife, bird_photography, or plant_botanical; otherwise an empty array. Prefer species-level names when visibly supported; broader taxa are allowed when narrower identification is uncertain.",
      "items": {
        "$ref": "#/$defs/candidate_with_evidence"
      }
    },
    "main_subjects": {
      "type": "array",
      "maxItems": 6,
      "description": "Primary visible subjects in the isolated crop.",
      "items": {
        "$ref": "#/$defs/candidate_with_evidence"
      }
    },
    "secondary_subjects": {
      "type": "array",
      "maxItems": 8,
      "description": "Secondary visible subjects or subject parts in the isolated crop.",
      "items": {
        "$ref": "#/$defs/candidate_with_evidence"
      }
    },
    "behavior_or_action": {
      "type": "array",
      "maxItems": 8,
      "description": "Visible pose, behavior, or action supported by the isolated subject alone.",
      "items": {
        "$ref": "#/$defs/candidate_without_evidence"
      }
    },
    "proposed_keywords": {
      "type": "array",
      "maxItems": 24,
      "description": "Metadata-oriented terms based only on the isolated subject. Exclude exact duplicate species/taxonomy terms, habitat, setting, camera, lens, and software terms.",
      "items": {
        "$ref": "#/$defs/candidate_with_evidence"
      }
    },
    "uncertainty_notes": {
      "type": "string",
      "minLength": 0,
      "maxLength": 600,
      "description": "Brief notes about uncertainty, partial visibility, mask/crop issues, or ambiguous identification."
    },
    "quality_assessment": {
      "type": "object",
      "additionalProperties": false,
      "description": "Perceptual quality assessment of the isolated subject only. Keep separate from tags and proposed keywords.",
      "required": [
        "focus",
        "exposure_and_tone",
        "lighting_and_color",
        "detail_and_texture",
        "pose_expression_or_moment",
        "technical_cleanliness",
        "overall_subject_quality",
        "strengths",
        "concerns",
        "confidence"
      ],
      "properties": {
        "focus": {
          "$ref": "#/$defs/quality_level",
          "description": "Sharpness of the subject's important features. Do not judge original frame placement."
        },
        "exposure_and_tone": {
          "$ref": "#/$defs/quality_level",
          "description": "Whether subject detail is retained in highlights, shadows, and midtones."
        },
        "lighting_and_color": {
          "$ref": "#/$defs/quality_level",
          "description": "Whether light and color render the subject clearly and coherently."
        },
        "detail_and_texture": {
          "$ref": "#/$defs/quality_level",
          "description": "Natural preservation of important texture and fine detail without smearing or excessive sharpening."
        },
        "pose_expression_or_moment": {
          "$ref": "#/$defs/quality_level",
          "description": "Effectiveness of visible pose, expression, gesture, or behavior. Use unrated when not relevant."
        },
        "technical_cleanliness": {
          "$ref": "#/$defs/quality_level",
          "description": "Obvious visible noise, halos, compression, oversmoothing, or processing artifacts on the subject. Ignore isolation-edge artifacts unless they obscure detail."
        },
        "overall_subject_quality": {
          "$ref": "#/$defs/quality_level",
          "description": "Overall quality of the isolated subject only; do not assess composition, background, or scene context."
        },
        "strengths": {
          "type": "array",
          "maxItems": 2,
          "description": "Up to two concise visible subject strengths. Use an empty array when none are clear.",
          "items": {
            "$ref": "#/$defs/quality_note"
          }
        },
        "concerns": {
          "type": "array",
          "maxItems": 2,
          "description": "Up to two concise visible subject weaknesses. Use an empty array when none are clear.",
          "items": {
            "$ref": "#/$defs/quality_note"
          }
        },
        "confidence": {
          "$ref": "#/$defs/confidence",
          "description": "Confidence in the subject-quality assessment as a whole."
        }
      }
    }
  },
  "$defs": {
    "confidence": {
      "type": "string",
      "enum": [
        "high",
        "medium",
        "low"
      ],
      "description": "Ordinal confidence band. Numeric confidence is intentionally not used."
    },
    "genre_term": {
      "type": "string",
      "enum": [
        "architecture",
        "landscape",
        "seascape",
        "cityscape",
        "portrait_people",
        "group_portrait",
        "candid_people",
        "street_documentary",
        "wildlife",
        "bird_photography",
        "plant_botanical",
        "macro_closeup",
        "abstract",
        "still_life",
        "product",
        "food",
        "sports_action",
        "event",
        "travel",
        "night",
        "astrophotography",
        "aerial",
        "underwater",
        "interior",
        "fine_art_conceptual"
      ],
      "description": "Controlled vocabulary for photographic genre or photography type."
    },
    "term": {
      "type": "string",
      "minLength": 1,
      "maxLength": 80,
      "pattern": "^[^\\r\\n\\t]+$"
    },
    "evidence": {
      "type": "string",
      "minLength": 1,
      "maxLength": 220,
      "pattern": "^[^\\r\\n\\t]+$",
      "description": "Short visible-evidence phrase, not a reasoning trace."
    },
    "candidate_with_evidence": {
      "type": "object",
      "additionalProperties": false,
      "required": [
        "term",
        "confidence",
        "evidence"
      ],
      "properties": {
        "term": {
          "$ref": "#/$defs/term"
        },
        "confidence": {
          "$ref": "#/$defs/confidence"
        },
        "evidence": {
          "$ref": "#/$defs/evidence"
        }
      }
    },
    "candidate_without_evidence": {
      "type": "object",
      "additionalProperties": false,
      "required": [
        "term",
        "confidence"
      ],
      "properties": {
        "term": {
          "$ref": "#/$defs/term"
        },
        "confidence": {
          "$ref": "#/$defs/confidence"
        }
      }
    },
    "genre_candidate": {
      "type": "object",
      "additionalProperties": false,
      "required": [
        "term",
        "confidence",
        "evidence"
      ],
      "properties": {
        "term": {
          "$ref": "#/$defs/genre_term"
        },
        "confidence": {
          "$ref": "#/$defs/confidence"
        },
        "evidence": {
          "$ref": "#/$defs/evidence"
        }
      }
    },
    "quality_level": {
      "type": "string",
      "enum": [
        "problem",
        "acceptable",
        "strong",
        "unrated"
      ],
      "description": "Use problem for a visible weakness, acceptable for adequate execution, strong when the criterion materially supports the photograph, and unrated when the criterion is not relevant or cannot be judged reliably."
    },
    "quality_note": {
      "type": "string",
      "minLength": 1,
      "maxLength": 160,
      "pattern": "^[^\\r\\n\\t]+$",
      "description": "One concise visible observation, not a reasoning trace or edit instruction."
    }
  }
}
